{
  "version": "0.1.0",
  "restock": {
    "turns": 250,
    "minKeep": 12,
    "maxKeep": 36,
    "turnover": 9,
    "shuffleChance": 35
  },
  "pricing": {
    "blackMarketMinValue": 40,
    "baseGreed": 110,
    "priceAdjustmentModel": "classic_charisma_adjustment"
  },
  "stockPools": {
    "general": [
      { "kind": "consumable", "consumableType": "food", "name": "Biscuit", "selectionWeight": 1 },
      { "kind": "consumable", "consumableType": "food", "name": "Jerky", "selectionWeight": 2 },
      { "kind": "consumable", "consumableType": "food", "name": "Pint of Ale", "selectionWeight": 1 },
      { "kind": "consumable", "consumableType": "food", "name": "Pint of Wine", "selectionWeight": 1 },
      { "kind": "consumable", "consumableType": "food", "name": "Ration of Food", "selectionWeight": 5 },
      { "kind": "template", "templateId": "brass_lantern", "selectionWeight": 2 },
      { "kind": "template", "templateId": "wooden_torch", "selectionWeight": 4 },
      { "kind": "template", "templateId": "flask_of_oil", "selectionWeight": 6 },
      { "kind": "template", "templateId": "arrow", "selectionWeight": 2 },
      { "kind": "template", "templateId": "bolt", "selectionWeight": 2 },
      { "kind": "template", "templateId": "iron_shot", "selectionWeight": 1 },
      { "kind": "template", "templateId": "pick", "selectionWeight": 1 },
      { "kind": "template", "templateId": "shovel", "selectionWeight": 1 },
      { "kind": "template", "templateId": "cloak", "selectionWeight": 3 }
    ],
    "armor": [
      { "kind": "template", "templateId": "hard_leather_cap", "selectionWeight": 2 },
      { "kind": "template", "templateId": "iron_helm", "selectionWeight": 1 },
      { "kind": "template", "templateId": "metal_cap", "selectionWeight": 1 },
      { "kind": "template", "templateId": "hard_leather_armor", "selectionWeight": 2 },
      { "kind": "template", "templateId": "hard_studded_leather", "selectionWeight": 2 },
      { "kind": "template", "templateId": "leather_scale_mail", "selectionWeight": 2 },
      { "kind": "template", "templateId": "robe", "selectionWeight": 2 },
      { "kind": "template", "templateId": "soft_leather_armor", "selectionWeight": 2 },
      { "kind": "template", "templateId": "augmented_chain_mail", "selectionWeight": 1 },
      { "kind": "template", "templateId": "bar_chain_mail", "selectionWeight": 1 },
      { "kind": "template", "templateId": "chain_mail", "selectionWeight": 2 },
      { "kind": "template", "templateId": "double_chain_mail", "selectionWeight": 1 },
      { "kind": "template", "templateId": "metal_brigandine_armor", "selectionWeight": 1 },
      { "kind": "template", "templateId": "metal_scale_mail", "selectionWeight": 1 },
      { "kind": "template", "templateId": "gauntlets", "selectionWeight": 1 },
      { "kind": "template", "templateId": "set_of_leather_gloves", "selectionWeight": 2 },
      { "kind": "template", "templateId": "pair_of_hard_leather_boots", "selectionWeight": 2 },
      { "kind": "template", "templateId": "pair_of_soft_leather_boots", "selectionWeight": 2 },
      { "kind": "template", "templateId": "large_leather_shield", "selectionWeight": 1 },
      { "kind": "template", "templateId": "small_leather_shield", "selectionWeight": 2 },
      { "kind": "template", "templateId": "small_metal_shield", "selectionWeight": 1 }
    ],
    "weapons": [
      { "kind": "template", "templateId": "arrow", "selectionWeight": 2 },
      { "kind": "template", "templateId": "bolt", "selectionWeight": 2 },
      { "kind": "template", "templateId": "iron_shot", "selectionWeight": 2 },
      { "kind": "template", "templateId": "light_crossbow", "selectionWeight": 1 },
      { "kind": "template", "templateId": "long_bow", "selectionWeight": 1 },
      { "kind": "template", "templateId": "short_bow", "selectionWeight": 1 },
      { "kind": "template", "templateId": "sling", "selectionWeight": 1 },
      { "kind": "template", "templateId": "whip", "selectionWeight": 1 },
      { "kind": "template", "templateId": "awl_pike", "selectionWeight": 1 },
      { "kind": "template", "templateId": "battle_axe", "selectionWeight": 1 },
      { "kind": "template", "templateId": "beaked_axe", "selectionWeight": 1 },
      { "kind": "template", "templateId": "broad_axe", "selectionWeight": 1 },
      { "kind": "template", "templateId": "lance", "selectionWeight": 1 },
      { "kind": "template", "templateId": "pike", "selectionWeight": 1 },
      { "kind": "template", "templateId": "spear", "selectionWeight": 1 },
      { "kind": "template", "templateId": "trident", "selectionWeight": 1 },
      { "kind": "template", "templateId": "bastard_sword", "selectionWeight": 1 },
      { "kind": "template", "templateId": "broad_sword", "selectionWeight": 1 },
      { "kind": "template", "templateId": "cutlass", "selectionWeight": 1 },
      { "kind": "template", "templateId": "dagger", "selectionWeight": 1 },
      { "kind": "template", "templateId": "katana", "selectionWeight": 1 },
      { "kind": "template", "templateId": "long_sword", "selectionWeight": 1 },
      { "kind": "template", "templateId": "main_gauche", "selectionWeight": 1 },
      { "kind": "template", "templateId": "rapier", "selectionWeight": 1 },
      { "kind": "template", "templateId": "sabre", "selectionWeight": 1 },
      { "kind": "template", "templateId": "scimitar", "selectionWeight": 1 },
      { "kind": "template", "templateId": "short_sword", "selectionWeight": 1 },
      { "kind": "template", "templateId": "small_sword", "selectionWeight": 1 },
      { "kind": "template", "templateId": "tulwar", "selectionWeight": 1 }
    ],
    "temple": [
      { "kind": "template", "templateId": "ball_and_chain", "selectionWeight": 1 },
      { "kind": "template", "templateId": "flail", "selectionWeight": 1 },
      { "kind": "template", "templateId": "lead_filled_mace", "selectionWeight": 1 },
      { "kind": "template", "templateId": "lucerne_hammer", "selectionWeight": 1 },
      { "kind": "template", "templateId": "mace", "selectionWeight": 2 },
      { "kind": "template", "templateId": "morning_star", "selectionWeight": 1 },
      { "kind": "template", "templateId": "quarterstaff", "selectionWeight": 1 },
      { "kind": "template", "templateId": "war_hammer", "selectionWeight": 1 },
      { "kind": "template", "templateId": "whip", "selectionWeight": 1 },
      { "kind": "template", "templateId": "generated_prayer_book_0", "selectionWeight": 3 },
      { "kind": "template", "templateId": "generated_prayer_book_1", "selectionWeight": 2 },
      { "kind": "template", "templateId": "generated_prayer_book_2", "selectionWeight": 2 },
      { "kind": "template", "templateId": "generated_prayer_book_3", "selectionWeight": 1 },
      { "kind": "consumable", "consumableType": "potion", "name": "Boldness", "selectionWeight": 1 },
      { "kind": "consumable", "consumableType": "potion", "name": "Cure Critical Wounds", "selectionWeight": 2 },
      { "kind": "consumable", "consumableType": "potion", "name": "Cure Light Wounds", "selectionWeight": 1 },
      { "kind": "consumable", "consumableType": "potion", "name": "Cure Serious Wounds", "selectionWeight": 2 },
      { "kind": "consumable", "consumableType": "potion", "name": "Heroism", "selectionWeight": 1 },
      { "kind": "consumable", "consumableType": "potion", "name": "Restore Life Levels", "selectionWeight": 2 },
      { "kind": "consumable", "consumableType": "scroll", "name": "Blessing", "selectionWeight": 1 },
      { "kind": "consumable", "consumableType": "scroll", "name": "Holy Chant", "selectionWeight": 1 },
      { "kind": "consumable", "consumableType": "scroll", "name": "Life", "selectionWeight": 2 },
      { "kind": "consumable", "consumableType": "scroll", "name": "Remove Curse", "selectionWeight": 1 }
    ],
    "alchemy": [
      { "kind": "consumable", "consumableType": "potion", "name": "Resist Cold", "selectionWeight": 1 },
      { "kind": "consumable", "consumableType": "potion", "name": "Resist Heat", "selectionWeight": 1 },
      { "kind": "consumable", "consumableType": "potion", "name": "Restore Charisma", "selectionWeight": 1 },
      { "kind": "consumable", "consumableType": "potion", "name": "Restore Constitution", "selectionWeight": 1 },
      { "kind": "consumable", "consumableType": "potion", "name": "Restore Dexterity", "selectionWeight": 1 },
      { "kind": "consumable", "consumableType": "potion", "name": "Restore Intelligence", "selectionWeight": 1 },
      { "kind": "consumable", "consumableType": "potion", "name": "Restore Strength", "selectionWeight": 1 },
      { "kind": "consumable", "consumableType": "potion", "name": "Restore Wisdom", "selectionWeight": 1 },
      { "kind": "consumable", "consumableType": "scroll", "name": "Detect Invisible", "selectionWeight": 1 },
      { "kind": "consumable", "consumableType": "scroll", "name": "Door/Stair Location", "selectionWeight": 1 },
      { "kind": "consumable", "consumableType": "scroll", "name": "Enchant Armor", "selectionWeight": 2 },
      { "kind": "consumable", "consumableType": "scroll", "name": "Enchant Weapon To-Dam", "selectionWeight": 2 },
      { "kind": "consumable", "consumableType": "scroll", "name": "Enchant Weapon To-Hit", "selectionWeight": 2 },
      { "kind": "consumable", "consumableType": "scroll", "name": "Identify", "selectionWeight": 4 },
      { "kind": "consumable", "consumableType": "scroll", "name": "Light", "selectionWeight": 1 },
      { "kind": "consumable", "consumableType": "scroll", "name": "Magic Mapping", "selectionWeight": 1 },
      { "kind": "consumable", "consumableType": "scroll", "name": "Monster Confusion", "selectionWeight": 1 },
      { "kind": "consumable", "consumableType": "scroll", "name": "Phase Door", "selectionWeight": 3 },
      { "kind": "consumable", "consumableType": "scroll", "name": "Recharging", "selectionWeight": 1 },